{"run":17,"commit":"668c756","metric":0,"metrics":{"build_ok":1,"off_alive":0,"off_nonsolid":0,"on_alive":0,"on_nonsolid":0,"crash_count":2},"status":"discard","description":"Taught Unix `--config` handling to create a missing prefs file at the requested path instead of exiting, which removed the earlier prefs-file startup error but immediately exposed a much worse regression: both jit=false and jit=true now segfault during startup before a window appears.","timestamp":1774396664070,"segment":0,"confidence":null,"asi":{"hypothesis":"Letting `--config <missing-path>` bootstrap defaults in place would unblock the smoke harness and allow the newly linked binary to reach window creation.","rollback_reason":"Primary metric regressed from 30 to 0 because both runtime modes now crash (exit 139), adding two crash penalties.","next_action_hint":"Debug the new early startup crash before keeping any prefs-loader change: capture a backtrace or inspect first-fault logs around prefs/bootstrap and JIT initialization, and compare with the original non-crashing 'missing prefs file' behavior.","failure_signature":"Both jit modes now log `Prefs file ... not found, creating new one there` and then exit 139 with no window; crash_count=2."}}
{"run":18,"commit":"668c756","metric":0,"metrics":{"build_ok":0,"off_alive":0,"off_nonsolid":0,"on_alive":0,"on_nonsolid":0,"crash_count":0},"status":"discard","description":"Tried to run a direct gdb reproduction with a precreated prefs file, but autoresearch mode rejected the custom command because this project requires `./autoresearch.sh` for experiment runs.","timestamp":1774396716684,"segment":0,"confidence":null,"asi":{"hypothesis":"A direct gdb run with a precreated prefs file would reveal the first runtime crash site behind the current missing-prefs harness blocker.","rollback_reason":"No benchmark data was collected; the experiment runner rejected non-harness commands in autoresearch mode.","next_action_hint":"Use bash/read for off-benchmark diagnostics, then return to `./autoresearch.sh` for scored runs; if needed, add temporary crash logging in code and evaluate via the harness.","failure_signature":"run_experiment rejected custom gdb command: `autoresearch.sh exists — you must run it instead of a custom command`"}}
{"run":19,"commit":"668c756","metric":30,"metrics":{"build_ok":1,"off_alive":0,"off_nonsolid":0,"on_alive":0,"on_nonsolid":0,"crash_count":0},"status":"discard","description":"Combined two runtime-unblock changes: missing `--config` paths now bootstrap a prefs file, and AArch64 Unix RAM/ROM mapping no longer forces `VM_MAP_32BIT`. This gets `jit=false` far enough to open a Basilisk window and keep running, but the harness times out because the emulator does not exit on the harness SIGTERM, so the full benchmark still cannot complete.","timestamp":1774398180605,"segment":0,"confidence":null,"asi":{"hypothesis":"Allowing missing config bootstrap plus dropping the low-4GB RAM/ROM requirement on AArch64 would unblock the real runtime path hidden behind the earlier prefs-file exit and vm_acquire failure.","rollback_reason":"No validated primary improvement yet; the benchmark never completed because the process stayed alive after the harness tried to terminate it.","next_action_hint":"Reapply these two changes and add explicit SIGTERM/SIGINT shutdown handling so the smoke harness can stop Basilisk cleanly after 20s; then rerun to collect real off/on metrics.","partial_evidence":"`jit_off` created a prefs file, opened an 800x600 `Basilisk II` window under Xvfb, and stayed alive until the outer experiment timeout killed Xvfb.","failure_signature":"run_experiment timed out after 1200s with `jit_off` still running; artifact shows window `0x200008 \"Basilisk II\"` in xwininfo tree and basilisk.log ends with `X connection to :99 broken` after forced teardown."}}
{"run":20,"commit":"668c756","metric":30,"metrics":{"build_ok":1,"off_alive":0,"off_nonsolid":0,"on_alive":0,"on_nonsolid":0,"crash_count":0},"status":"discard","description":"Retried the runtime-unblock pair and added a Unix SIGTERM handler plus a safer NULL guard in `QuitEmulator()`. The emulator still ignores the harness shutdown path, so `jit=false` opens a Basilisk window and keeps running but the benchmark times out before it can score or reach `jit=true`.","timestamp":1774399543043,"segment":0,"confidence":null,"asi":{"hypothesis":"Missing-config bootstrap plus AArch64 high-address RAM mapping were the real runtime blockers, and a simple SIGTERM-to-quit hook would let the smoke harness finish cleanly.","rollback_reason":"No validated primary improvement yet; despite the visible window, the benchmark still times out in `jit_off` and never collects full off/on metrics.","next_action_hint":"Treat this as a harness robustness issue next: add a forced-kill fallback in `autoresearch.sh` after the 20s observation window so long-lived successful runs can be scored, then rerun on the current kept code.","partial_evidence":"`jit_off` again created the prefs file, opened `Basilisk II` under Xvfb, and remained alive even after manual SIGTERM.","failure_signature":"run_experiment timed out after 1200s with `jit_off` still alive; manual `kill -TERM` left the BasiliskII process running, and no `result.env` was written."}}
{"run":21,"commit":"003e4a8","metric":35,"metrics":{"build_ok":1,"off_alive":1,"off_nonsolid":0,"on_alive":0,"on_nonsolid":0,"crash_count":1},"status":"keep","description":"Combined three runtime-unblock fixes on top of the linked AArch64 JIT build: missing `--config` paths now bootstrap a prefs file, Unix AArch64 RAM/ROM allocation no longer forces low-4GB mappings, and the harness now SIGKILL-falls back after the 20s observation window. This gets `jit=false` to open a Basilisk window and survive 20s, raising the score from 30 to 35; `jit=true` still segfaults early.","timestamp":1774399673933,"segment":0,"confidence":null,"asi":{"hypothesis":"The real runtime blockers after link were missing-config startup and low-address RAM allocation, and once those were removed the harness only needed a robust teardown path to score the long-lived non-JIT run.","runtime_progress":"jit=false now window_found=1 survived_20s=1 alive=1","remaining_failure":"jit=true still exits 139 before a window appears","harness_change":"added a SIGKILL fallback after SIGTERM so long-lived successful runs do not hang the benchmark indefinitely","next_action_hint":"Debug the `jit=true` early crash on the current kept code path—likely in ARM64 JIT initialization or first compiled block bring-up—using off-benchmark diagnostics, then convert the fix into another harness-scored run."}}
{"run":22,"commit":"003e4a8","metric":35,"metrics":{"build_ok":1,"off_alive":1,"off_nonsolid":0,"on_alive":0,"on_nonsolid":0,"crash_count":1},"status":"discard","description":"Tried eagerly calling `init_table68k()` + `build_comp()` from the imported ARM `compiler_init()` so JIT runtime stubs are definitely built before `m68k_compile_execute()`, but the harness score stayed unchanged: non-JIT still survives 20s, while `jit=true` still segfaults before opening a window.","timestamp":1774399845777,"segment":0,"confidence":null,"asi":{"hypothesis":"The `jit=true` null-call crash might come from never building the ARM JIT dispatcher/stub tables before entering compiled execution, so front-loading `build_comp()` in `compiler_init()` would unblock startup.","rollback_reason":"Primary metric did not improve; `jit=true` still crashes early and the score remains 35.","next_action_hint":"Capture a fresh `jit=true` backtrace on the kept runtime-unblocked code to find the new crash site after this init change, then patch that concrete ARM64 JIT startup failure.","failure_signature":"Benchmark unchanged at build_ok=1, off_alive=1, on_alive=0, crash_count=1; `jit=true` still exits 139 during early startup."}}
{"run":23,"commit":"003e4a8","metric":0,"metrics":{"build_ok":0,"off_alive":0,"off_nonsolid":0,"on_alive":0,"on_nonsolid":0,"crash_count":0},"status":"discard","description":"Tried pairing a null-dispatcher guard with eager `build_comp()` from the imported ARM `compiler_init()`, but that exposes another missing wrapper surface at link time: the imported popall stubs need Basilisk exports for `execute_normal`, `exec_nostats`, `do_nothing`, and `execute_exception`.","timestamp":1774400096981,"segment":0,"confidence":null,"asi":{"hypothesis":"If the JIT crash came from entering compiled execution before ARM dispatcher stubs were built, then calling `build_comp()` during `compiler_init()` plus a null guard would either fix startup or at least fail gracefully.","rollback_reason":"No score improvement; the build regressed because enabling `build_comp()` pulled in new unresolved dispatcher entry points before runtime could be measured.","next_action_hint":"Keep the current best commit as the runtime baseline and, if revisiting eager `build_comp()`, first add Basilisk-facing wrappers for `execute_normal`, `exec_nostats`, `do_nothing`, and `execute_exception` with the exact signatures expected by the imported ARM support.","failure_signature":"Link failure from compemu_support_arm popall setup: undefined `execute_normal()`, `exec_nostats()`, `do_nothing()`, and `execute_exception(unsigned int)` after calling `build_comp()` in compiler_init."}}
{"run":24,"commit":"003e4a8","metric":35,"metrics":{"build_ok":1,"off_alive":1,"off_nonsolid":0,"on_alive":0,"on_nonsolid":0,"crash_count":1},"status":"discard","description":"Revisited eager ARM JIT dispatcher/table construction together with Basilisk-facing wrappers for `execute_normal`, `exec_nostats`, `do_nothing`, and `execute_exception`, but the harness result stayed unchanged: `jit=false` survives 20s, while `jit=true` still segfaults before opening a window.","timestamp":1774400464104,"segment":0,"confidence":14,"asi":{"hypothesis":"The remaining `jit=true` null-call startup failure would clear once the imported ARM popall setup had both eager `build_comp()` and the missing dispatcher entry wrappers it expects.","rollback_reason":"Primary metric did not improve; score stayed 35 and the JIT-enabled runtime still crashes early.","next_action_hint":"Capture a fresh `jit=true` backtrace specifically on the kept 003e4a8 runtime-unblocked baseline to identify the next concrete crash site beyond the previous null-dispatch suspicion, then patch that exact failure.","failure_signature":"Benchmark unchanged at build_ok=1, off_alive=1, on_alive=0, crash_count=1; `jit_on/basilisk.log` still only reaches `Prefs file ... not found, creating new one there` before exit 139."}}
{"run":25,"commit":"003e4a8","metric":0,"metrics":{"build_ok":0,"off_alive":0,"off_nonsolid":0,"on_alive":0,"on_nonsolid":0,"crash_count":0},"status":"discard","description":"Tried to force real ARM JIT bring-up by syncing prefs into the imported runtime, eagerly calling `build_comp()`, and adding Basilisk-facing dispatcher wrappers. Once the build actually recompiled generated `compemu.cpp`, it failed much earlier on a broader helper-surface mismatch, so the previous incremental result was not a real improvement.","timestamp":1774400952054,"segment":0,"confidence":14,"asi":{"hypothesis":"If `jit=true` only crashed because the imported ARM runtime never received real prefs or built its dispatcher/cache state, then syncing prefs plus eager `build_comp()` and dispatcher wrappers would advance startup beyond the null-call failure.","rollback_reason":"No score improvement; a real rebuild exposed larger generator/helper incompatibilities and `build_ok` dropped to 0.","next_action_hint":"Treat clean/incremental consistency as the next blocker: either force the harness to rebuild generated JIT objects when included ARM support files change, or confine experiments to surfaces that do not require regenerating/clean-recompiling `compemu.cpp` until the missing helper API (`start_needflags`, `add_l`, `cmp_w`, etc.) is reconciled.","failure_signature":"When `compemu.cpp` is recompiled, many generated helpers are missing again (`start_needflags`, `end_needflags`, `add_b/add_w/add_l`, `cmp_w`, `or_b`, `test_l_rr`, `duplicate_carry`, etc.), causing build failure in compemu1..8 objects."}}
{"run":26,"commit":"003e4a8","metric":0,"metrics":{"build_ok":0,"off_alive":0,"off_nonsolid":0,"on_alive":0,"on_nonsolid":0,"crash_count":0},"status":"discard","description":"Confirmed the eager-`build_comp()` path only becomes meaningful after syncing real prefs into the imported ARM runtime, but as soon as that path forces recompilation of `compemu.cpp`, the experiment hits a much broader missing helper API in the generated AArch64 JIT surface and fails to build.","timestamp":1774401120686,"segment":0,"confidence":14,"asi":{"hypothesis":"`jit=true` was failing because the imported ARM runtime never saw real prefs/cachesize, so directly syncing prefs before `build_comp()` plus dispatcher wrappers would let JIT startup advance past the null dispatcher call.","rollback_reason":"No score improvement; forcing the generated JIT objects to rebuild exposed a larger clean-build incompatibility and `build_ok` dropped to 0.","next_action_hint":"Pivot to the clean-build blocker explicitly: add the legacy helper/macro compatibility layer that generated `compemu.cpp` expects on AArch64 (`start_needflags`, `end_needflags`, `test_l_rr`, `xor_l`, and the rest of that family) before retrying eager `build_comp()` startup experiments.","failure_signature":"With prefs synced, `compemu.cpp` recompilation fails on many missing helpers again, e.g. `start_needflags`, `end_needflags`, `test_l_rr`, `xor_l`, `add_*`, `cmp_*`, `or_*`, `duplicate_carry`, `mov_[bw]_rr`, and `zero_extend_*_rr`."}}
{"run":27,"commit":"003e4a8","metric":0,"metrics":{"build_ok":0,"off_alive":0,"off_nonsolid":0,"on_alive":0,"on_nonsolid":0,"crash_count":0},"status":"discard","description":"Added a first clean-build ARM64 compatibility batch for legacy gencomp helpers (`start/end_needflags`, ALU/test/move/extend wrappers, and carry duplication/restore). The real rebuild now gets far past the original missing-helper wall, but `build_ok` is still blocked by the next narrower x86-shaped surface: `bt*/sbb/setcc/cmov`, rotate/shift wrappers, endian load/store helpers (`mov_[lw]_[rR|Rr]` + `mid_bswap_*`), and 32x32/64x32 mul helpers.","timestamp":1774401704089,"segment":0,"confidence":14,"asi":{"hypothesis":"A first batch of straightforward ALU/test/move compatibility wrappers would make clean ARM64 `compemu.cpp` rebuilds honest and narrow the remaining helper gap to a smaller x86-flavored surface.","rollback_reason":"Primary metric stayed at 0 because the clean rebuild still fails before producing a binary.","next_action_hint":"Implement the next narrowed compatibility batch (`bt*/sbb/setcc/cmov`, rotate/shift wrappers, endian move+bswap helpers, and mul helpers), then rerun `./autoresearch.sh` to see whether the build gate finally clears.","narrowed_failure_surface":["bt_l_rr","btc_l_rr","btr_l_rr","bts_l_rr","sbb_l","setcc","cmov_l_rr","mov_l_rR","mov_l_Rr","mov_w_rR","mid_bswap_16","mid_bswap_32","imul_32_32","imul_64_32","mul_64_32","shll_l_ri","rol_l_rr"]}}
{"run":28,"commit":"003e4a8","metric":35,"metrics":{"build_ok":1,"off_alive":1,"off_nonsolid":0,"on_alive":0,"on_nonsolid":0,"crash_count":1},"status":"discard","description":"Reapplied the clean-build ARM64 helper compatibility layer and paired it with eager `build_comp()` from `compiler_init()` after syncing live Prefs. A real clean rebuild now succeeds again, but the scored smoke result stays unchanged at 35: `jit=false` still survives 20s, while `jit=true` still segfaults before opening a window.","timestamp":1774402412115,"segment":0,"confidence":null,"asi":{"hypothesis":"With the broader clean-build helper layer in place, forcing `check_prefs_changed_comp(false)` + eager `build_comp()` during `compiler_init()` would finally populate popall/pushall state before `m68k_do_compile_execute()` and move `jit=true` past the null-dispatch startup crash.","rollback_reason":"Primary metric did not improve; despite the honest clean-build progress, the harness still scores 35 with `jit=true` crashing early.","next_action_hint":"Use off-benchmark diagnostics on this exact combined patchset to capture the new `jit=true` crash site after eager `build_comp()` now that clean builds work, then convert the concrete fix into another scored run.","honest_build_note":"Manual pre-run `make -j8` rebuilt clean ARM64 `compemu.cpp` objects and linked BasiliskII successfully before the scored harness run.","artifact_dir":"/workspace/tmp/autoresearch-jit-20260325-013210"}}
{"run":29,"commit":"003e4a8","metric":35,"metrics":{"build_ok":1,"off_alive":1,"off_nonsolid":0,"on_alive":0,"on_nonsolid":0,"crash_count":1},"status":"discard","description":"Added a lazy ARM64 JIT bring-up path at first compiled execution, together with the clean-build helper compatibility layer. This changed the `jit=true` failure mode from a null-call segfault to an explicit runtime abort: the late `build_comp()` path now runs far enough to fail in `create_popalls()` with `Could not allocate popallspace!`, but the score remains 35 because `jit=true` still never opens a window.","timestamp":1774403037382,"segment":0,"confidence":null,"asi":{"hypothesis":"If `build_comp()` was simply happening at the wrong time, forcing it lazily from `m68k_do_compile_execute()` after syncing Prefs would initialize dispatcher stubs before the first compiled jump and move `jit=true` past the null-call crash.","rollback_reason":"Primary metric stayed unchanged at 35; the crash became more explicit but `on_alive` did not improve.","next_action_hint":"Fix ARM64 popall/code allocation next: drop the forced `VM_MAP_32BIT` requirement in `do_alloc_code()` / popallspace allocation on AArch64 and rerun the same lazy-bringup path.","new_failure_signature":"jit_on now aborts with `Could not allocate popallspace!` instead of calling through NULL; artifact /workspace/tmp/autoresearch-jit-20260325-014241/jit_on/basilisk.log","learning":"The lazy-build path is promising because it exposes a concrete ARM64 code-allocation blocker rather than the earlier opaque null dispatcher crash."}}
